<Organization xmlns="http://javaops.ru"
              xmlns:xsi="http://www.w3.org/2001/XMLSchema-instance"
              xsi:schemaLocation="http://javaops.ru employees.xsd">
    <dept>
        <Deptno>10</Deptno>
        <Dname>Accounting</Dname>
        <Loc>Dallas</Loc>
    </dept>
    <dept>
        <Deptno>20</Deptno>
        <Dname>Production</Dname>
        <Loc>New York</Loc>
    </dept>
    <Employee>
        <Empno>1001</Empno>
        <Ename>Jag</Ename>
        <Sal>2500</Sal>
        <Deptno>10</Deptno>
    </Employee>
    <Employee>
        <Empno>1002</Empno>
        <Ename>Win</Ename>
        <Sal>2600</Sal>
        <Deptno>21</Deptno>
    </Employee>
</Organization>